{"backends":["pip"],"catalog_sha256":"bbbbbbbbbbbbbbbbbbbbbbbbbbbbbbbbbbbbbbbbbbbbbbbbbbbbbbbbbbbbbbbb","destination":"tools/example-tool","generation":"generation-1","platform":{"arch":"x86_64","os":"linux"},"previous_generation":null,"python_version":"3.11.9","release":{"artifact":{"path":"tools/example-tool-1.0.0.zip","sha256":"aaaaaaaaaaaaaaaaaaaaaaaaaaaaaaaaaaaaaaaaaaaaaaaaaaaaaaaaaaaaaaaa","size":42},"locks":[{"backend":"pip","packages":[],"platform":{"arch":"x86_64","os":"linux"},"python":{"maximum_exclusive":"3.15.0","minimum":"3.11.0"},"schema_version":1}],"tool":{"commands":[{"arguments":[{"choices":[],"default":null,"help":"Target to inspect","kind":"positional","name":"target","required":true,"schema_version":1,"value_type":"string"}],"help":"Inspect local files","name":"inspect","schema_version":1}],"description":"An offline example","entrypoint":"example_tool:main","name":"example-tool","platforms":[{"arch":"x86_64","os":"linux"}],"python":{"maximum_exclusive":"3.15.0","minimum":"3.11.0"},"schema_version":1,"version":"1.0.0"}},"schema_version":1}
